{
  "event_id": "30000000-0000-4000-8000-000000000003",
  "event_type": "trip.completed.v1",
  "event_version": 1,
  "occurred_at": "2026-08-01T16:00:00Z",
  "organization_id": 1,
  "aggregate_type": "trip",
  "aggregate_id": 1,
  "trip_id": 1,
  "booking_id": 1,
  "boat_id": 1,
  "inventory_revision": 3,
  "status": "COMPLETED"
}
